{
  "$schema": "../schema/layer.schema.json",
  "formatVersion": 1,
  "device": "codex_micro",
  "name": "Claude Desktop",
  "description": "Claude Desktop recent tasks, task controls, voice input, and zoom controls for macOS.",
  "author": "duolahypercho",
  "actionGroupColor": "#D97757",
  "actions": [
    {
      "id": 0,
      "name": "Recent Task 1",
      "color": null,
      "icon": "icon-message-fas",
      "keyInputs": [
        {
          "keycode": "KC_LCTL",
          "delay": 0,
          "actionType": 1
        },
        {
          "keycode": "KC_LALT",
          "delay": 0,
          "actionType": 1
        },
        {
          "keycode": "KC_LGUI",
          "delay": 0,
          "actionType": 1
        },
        {
          "keycode": "KC_1",
          "delay": 0,
          "actionType": 2
        },
        {
          "keycode": "KC_LGUI",
          "delay": 0,
          "actionType": 0
        },
        {
          "keycode": "KC_LALT",
          "delay": 0,
          "actionType": 0
        },
        {
          "keycode": "KC_LCTL",
          "delay": 0,
          "actionType": 0
        }
      ]
    },
    {
      "id": 1,
      "name": "Recent Task 2",
      "color": null,
      "icon": "icon-message-fas",
      "keyInputs": [
        {
          "keycode": "KC_LCTL",
          "delay": 0,
          "actionType": 1
        },
        {
          "keycode": "KC_LALT",
          "delay": 0,
          "actionType": 1
        },
        {
          "keycode": "KC_LGUI",
          "delay": 0,
          "actionType": 1
        },
        {
          "keycode": "KC_2",
          "delay": 0,
          "actionType": 2
        },
        {
          "keycode": "KC_LGUI",
          "delay": 0,
          "actionType": 0
        },
        {
          "keycode": "KC_LALT",
          "delay": 0,
          "actionType": 0
        },
        {
          "keycode": "KC_LCTL",
          "delay": 0,
          "actionType": 0
        }
      ]
    },
    {
      "id": 2,
      "name": "Recent Task 3",
      "color": null,
      "icon": "icon-message-fas",
      "keyInputs": [
        {
          "keycode": "KC_LCTL",
          "delay": 0,
          "actionType": 1
        },
        {
          "keycode": "KC_LALT",
          "delay": 0,
          "actionType": 1
        },
        {
          "keycode": "KC_LGUI",
          "delay": 0,
          "actionType": 1
        },
        {
          "keycode": "KC_3",
          "delay": 0,
          "actionType": 2
        },
        {
          "keycode": "KC_LGUI",
          "delay": 0,
          "actionType": 0
        },
        {
          "keycode": "KC_LALT",
          "delay": 0,
          "actionType": 0
        },
        {
          "keycode": "KC_LCTL",
          "delay": 0,
          "actionType": 0
        }
      ]
    },
    {
      "id": 3,
      "name": "Recent Task 4",
      "color": null,
      "icon": "icon-message-fas",
      "keyInputs": [
        {
          "keycode": "KC_LCTL",
          "delay": 0,
          "actionType": 1
        },
        {
          "keycode": "KC_LALT",
          "delay": 0,
          "actionType": 1
        },
        {
          "keycode": "KC_LGUI",
          "delay": 0,
          "actionType": 1
        },
        {
          "keycode": "KC_4",
          "delay": 0,
          "actionType": 2
        },
        {
          "keycode": "KC_LGUI",
          "delay": 0,
          "actionType": 0
        },
        {
          "keycode": "KC_LALT",
          "delay": 0,
          "actionType": 0
        },
        {
          "keycode": "KC_LCTL",
          "delay": 0,
          "actionType": 0
        }
      ]
    },
    {
      "id": 4,
      "name": "Recent Task 5",
      "color": null,
      "icon": "icon-message-fas",
      "keyInputs": [
        {
          "keycode": "KC_LCTL",
          "delay": 0,
          "actionType": 1
        },
        {
          "keycode": "KC_LALT",
          "delay": 0,
          "actionType": 1
        },
        {
          "keycode": "KC_LGUI",
          "delay": 0,
          "actionType": 1
        },
        {
          "keycode": "KC_5",
          "delay": 0,
          "actionType": 2
        },
        {
          "keycode": "KC_LGUI",
          "delay": 0,
          "actionType": 0
        },
        {
          "keycode": "KC_LALT",
          "delay": 0,
          "actionType": 0
        },
        {
          "keycode": "KC_LCTL",
          "delay": 0,
          "actionType": 0
        }
      ]
    },
    {
      "id": 5,
      "name": "Recent Task 6",
      "color": null,
      "icon": "icon-message-fas",
      "keyInputs": [
        {
          "keycode": "KC_LCTL",
          "delay": 0,
          "actionType": 1
        },
        {
          "keycode": "KC_LALT",
          "delay": 0,
          "actionType": 1
        },
        {
          "keycode": "KC_LGUI",
          "delay": 0,
          "actionType": 1
        },
        {
          "keycode": "KC_6",
          "delay": 0,
          "actionType": 2
        },
        {
          "keycode": "KC_LGUI",
          "delay": 0,
          "actionType": 0
        },
        {
          "keycode": "KC_LALT",
          "delay": 0,
          "actionType": 0
        },
        {
          "keycode": "KC_LCTL",
          "delay": 0,
          "actionType": 0
        }
      ]
    },
    {
      "id": 6,
      "name": "Toggle Fast Mode",
      "color": null,
      "icon": "icon-bolt-lightning-fas",
      "keyInputs": [
        {
          "keycode": "KC_LCTL",
          "delay": 0,
          "actionType": 1
        },
        {
          "keycode": "KC_LALT",
          "delay": 0,
          "actionType": 1
        },
        {
          "keycode": "KC_LGUI",
          "delay": 0,
          "actionType": 1
        },
        {
          "keycode": "KC_F",
          "delay": 0,
          "actionType": 2
        },
        {
          "keycode": "KC_LGUI",
          "delay": 0,
          "actionType": 0
        },
        {
          "keycode": "KC_LALT",
          "delay": 0,
          "actionType": 0
        },
        {
          "keycode": "KC_LCTL",
          "delay": 0,
          "actionType": 0
        }
      ]
    },
    {
      "id": 7,
      "name": "Confirm Current Request",
      "color": null,
      "icon": "icon-check-double-fas",
      "keyInputs": [
        {
          "keycode": "KC_Y",
          "delay": 0,
          "actionType": 2
        }
      ]
    },
    {
      "id": 8,
      "name": "Cancel Current Request",
      "color": null,
      "icon": "icon-xmark-fas",
      "keyInputs": [
        {
          "keycode": "KC_N",
          "delay": 0,
          "actionType": 2
        }
      ]
    },
    {
      "id": 9,
      "name": "Fork Current Task",
      "color": null,
      "icon": "icon-arrows-turn-to-dots-fas",
      "keyInputs": [
        {
          "keycode": "KC_LCTL",
          "delay": 0,
          "actionType": 1
        },
        {
          "keycode": "KC_LALT",
          "delay": 0,
          "actionType": 1
        },
        {
          "keycode": "KC_LGUI",
          "delay": 0,
          "actionType": 1
        },
        {
          "keycode": "KC_K",
          "delay": 0,
          "actionType": 2
        },
        {
          "keycode": "KC_LGUI",
          "delay": 0,
          "actionType": 0
        },
        {
          "keycode": "KC_LALT",
          "delay": 0,
          "actionType": 0
        },
        {
          "keycode": "KC_LCTL",
          "delay": 0,
          "actionType": 0
        }
      ]
    },
    {
      "id": 10,
      "name": "Zoom Out",
      "color": null,
      "icon": "icon-magnifying-glass-minus-fas",
      "keyInputs": [
        {
          "keycode": "KC_LGUI",
          "delay": 0,
          "actionType": 1
        },
        {
          "keycode": "KC_MINS",
          "delay": 0,
          "actionType": 1
        },
        {
          "keycode": "KC_LGUI",
          "delay": 0,
          "actionType": 0
        }
      ]
    },
    {
      "id": 11,
      "name": "Zoom In",
      "color": null,
      "icon": "icon-magnifying-glass-plus-fas",
      "keyInputs": [
        {
          "keycode": "KC_LGUI",
          "delay": 0,
          "actionType": 1
        },
        {
          "keycode": "KC_EQL",
          "delay": 0,
          "actionType": 1
        },
        {
          "keycode": "KC_LGUI",
          "delay": 0,
          "actionType": 0
        }
      ]
    },
    {
      "id": 12,
      "name": "Actual Size",
      "color": null,
      "icon": "icon-maximize-fas",
      "keyInputs": [
        {
          "keycode": "KC_LGUI",
          "delay": 0,
          "actionType": 1
        },
        {
          "keycode": "KC_0",
          "delay": 0,
          "actionType": 1
        },
        {
          "keycode": "KC_LGUI",
          "delay": 0,
          "actionType": 0
        }
      ]
    },
    {
      "id": 13,
      "name": "Send Message",
      "color": null,
      "icon": "icon-paper-plane-fas",
      "keyInputs": [
        {
          "keycode": "KC_ENT",
          "delay": 0,
          "actionType": 2
        }
      ]
    },
    {
      "id": 14,
      "name": "Focus Claude",
      "color": null,
      "icon": "icon-window-restore-fas",
      "keyInputs": [
        {
          "keycode": "KC_LCTL",
          "delay": 0,
          "actionType": 1
        },
        {
          "keycode": "KC_LALT",
          "delay": 0,
          "actionType": 1
        },
        {
          "keycode": "KC_LGUI",
          "delay": 0,
          "actionType": 1
        },
        {
          "keycode": "KC_C",
          "delay": 0,
          "actionType": 2
        },
        {
          "keycode": "KC_LGUI",
          "delay": 0,
          "actionType": 0
        },
        {
          "keycode": "KC_LALT",
          "delay": 0,
          "actionType": 0
        },
        {
          "keycode": "KC_LCTL",